{
  "config": {
    "advancementPolicy": "retrosheet-runner-outs-v1",
    "contextualModel": {
      "cells": [
        {
          "baseMask": 0,
          "choices": [
            {
              "destinations": [0, 5, 5, 5],
              "rbi": [false, false, false, false],
              "runnerPlay": {
                "outBases": [2, 0, 0, 0],
                "outKinds": ["tag", "none", "none", "none"],
                "runsBeforeOuts": false
              },
              "weight": 9201
            },
            {
              "destinations": [1, 5, 5, 5],
              "rbi": [false, false, false, false],
              "weight": 980035
            },
            {
              "destinations": [2, 5, 5, 5],
              "rbi": [false, false, false, false],
              "runnerPlay": {
                "outBases": [0, 0, 0, 0],
                "outKinds": ["none", "none", "none", "none"],
                "runsBeforeOuts": false
              },
              "weight": 10070
            },
            {
              "destinations": [3, 5, 5, 5],
              "rbi": [false, false, false, false],
              "runnerPlay": {
                "outBases": [0, 0, 0, 0],
                "outKinds": ["none", "none", "none", "none"],
                "runsBeforeOuts": false
              },
              "weight": 694
            }
          ],
          "event": "single",
          "fallback": false,
          "observations": 11520,
          "outs": 0
        },
        {
          "baseMask": 1,
          "choices": [
            {
              "destinations": [0, 3, 5, 5],
              "rbi": [false, false, false, false],
              "runnerPlay": {
                "outBases": [2, 0, 0, 0],
                "outKinds": ["tag", "none", "none", "none"],
                "runsBeforeOuts": false
              },
              "weight": 4387
            },
            {
              "destinations": [1, 0, 5, 5],
              "rbi": [false, false, false, false],
              "runnerPlay": {
                "outBases": [0, 2, 0, 0],
                "outKinds": ["none", "tag", "none", "none"],
                "runsBeforeOuts": false
              },
              "weight": 366
            },
            {
              "destinations": [1, 0, 5, 5],
              "rbi": [false, false, false, false],
              "runnerPlay": {
                "outBases": [0, 3, 0, 0],
                "outKinds": ["none", "tag", "none", "none"],
                "runsBeforeOuts": false
              },
              "weight": 2559
            },
            {
              "destinations": [1, 2, 5, 5],
              "rbi": [false, false, false, false],
              "weight": 719927
            },
            {
              "destinations": [1, 3, 5, 5],
              "rbi": [false, false, false, false],
              "weight": 240951
            },
            {
              "destinations": [1, 4, 5, 5],
              "rbi": [false, true, false, false],
              "weight": 366
            },
            {
              "destinations": [2, 0, 5, 5],
              "rbi": [false, false, false, false],
              "runnerPlay": {
                "outBases": [0, 3, 0, 0],
                "outKinds": ["none", "tag", "none", "none"],
                "runsBeforeOuts": false
              },
              "weight": 1828
            },
            {
              "destinations": [2, 3, 5, 5],
              "rbi": [false, false, false, false],
              "runnerPlay": {
                "outBases": [0, 0, 0, 0],
                "outKinds": ["none", "none", "none", "none"],
                "runsBeforeOuts": false
              },
              "weight": 24863
            },
            {
              "destinations": [2, 4, 5, 5],
              "rbi": [false, false, false, false],
              "runnerPlay": {
                "outBases": [0, 0, 0, 0],
                "outKinds": ["none", "none", "none", "none"],
                "runsBeforeOuts": false
              },
              "weight": 3291
            },
            {
              "destinations": [3, 4, 5, 5],
              "rbi": [false, false, false, false],
              "runnerPlay": {
                "outBases": [0, 0, 0, 0],
                "outKinds": ["none", "none", "none", "none"],
                "runsBeforeOuts": false
              },
              "weight": 1462
            }
          ],
          "event": "single",
          "fallback": false,
          "observations": 2735,
          "outs": 0
        },
        {
          "baseMask": 2,
          "choices": [
            {
              "destinations": [0, 5, 3, 5],
              "rbi": [false, false, false, false],
              "runnerPlay": {
                "outBases": [2, 0, 0, 0],
                "outKinds": ["tag", "none", "none", "none"],
                "runsBeforeOuts": false
              },
              "weight": 2445
            },
            {
              "destinations": [1, 5, 0, 5],
              "rbi": [false, false, false, false],
              "runnerPlay": {
                "outBases": [0, 0, 3, 0],
                "outKinds": ["none", "none", "tag", "none"],
                "runsBeforeOuts": false
              },
              "weight": 2445
            },
            {
              "destinations": [1, 5, 0, 5],
              "rbi": [false, false, false, false],
              "runnerPlay": {
                "outBases": [0, 0, 4, 0],
                "outKinds": ["none", "none", "tag", "none"],
                "runsBeforeOuts": false
              },
              "weight": 4890
            },
            {
              "destinations": [1, 5, 2, 5],
              "rbi": [false, false, false, false],
              "weight": 51345
            },
            {
              "destinations": [1, 5, 3, 5],
              "rbi": [false, false, false, false],
              "weight": 578240
            },
            {
              "destinations": [1, 5, 4, 5],
              "rbi": [false, false, false, false],
              "weight": 7335
            },
            {
              "destinations": [1, 5, 4, 5],
              "rbi": [false, false, true, false],
              "weight": 300734
            },
            {
              "destinations": [2, 5, 0, 5],
              "rbi": [false, false, false, false],
              "runnerPlay": {
                "outBases": [0, 0, 4, 0],
                "outKinds": ["none", "none", "tag", "none"],
                "runsBeforeOuts": false
              },
              "weight": 7335
            },
            {
              "destinations": [2, 5, 3, 5],
              "rbi": [false, false, false, false],
              "runnerPlay": {
                "outBases": [0, 0, 0, 0],
                "outKinds": ["none", "none", "none", "none"],
                "runsBeforeOuts": false
              },
              "weight": 15892
            },
            {
              "destinations": [2, 5, 4, 5],
              "rbi": [false, false, false, false],
              "runnerPlay": {
                "outBases": [0, 0, 0, 0],
                "outKinds": ["none", "none", "none", "none"],
                "runsBeforeOuts": false
              },
              "weight": 7335
            },
            {
              "destinations": [2, 5, 4, 5],
              "rbi": [false, false, true, false],
              "runnerPlay": {
                "outBases": [0, 0, 0, 0],
                "outKinds": ["none", "none", "none", "none"],
                "runsBeforeOuts": false
              },
              "weight": 20782
            },
            {
              "destinations": [3, 5, 4, 5],
              "rbi": [false, false, true, false],
              "runnerPlay": {
                "outBases": [0, 0, 0, 0],
                "outKinds": ["none", "none", "none", "none"],
                "runsBeforeOuts": false
              },
              "weight": 1222
            }
          ],
          "event": "single",
          "fallback": false,
          "observations": 818,
          "outs": 0
        },
        {
          "baseMask": 3,
          "choices": [
            {
              "destinations": [1, 0, 3, 5],
              "rbi": [false, false, false, false],
              "runnerPlay": {
                "outBases": [0, 2, 0, 0],
                "outKinds": ["none", "tag", "none", "none"],
                "runsBeforeOuts": false
              },
              "weight": 1506
            },
            {
              "destinations": [1, 0, 3, 5],
              "rbi": [false, false, false, false],
              "runnerPlay": {
                "outBases": [0, 3, 0, 0],
                "outKinds": ["none", "tag", "none", "none"],
                "runsBeforeOuts": false
              },
              "weight": 1506
            },
            {
              "destinations": [1, 2, 0, 5],
              "rbi": [false, false, false, false],
              "runnerPlay": {
                "outBases": [0, 0, 4, 0],
                "outKinds": ["none", "none", "tag", "none"],
                "runsBeforeOuts": false
              },
              "weight": 4518
            },
            {
              "destinations": [1, 2, 3, 5],
              "rbi": [false, false, false, false],
              "weight": 566265
            },
            {
              "destinations": [1, 2, 4, 5],
              "rbi": [false, false, false, false],
              "weight": 1506
            },
            {
              "destinations": [1, 2, 4, 5],
              "rbi": [false, false, true, false],
              "weight": 239458
            },
            {
              "destinations": [1, 3, 0, 5],
              "rbi": [false, false, false, false],
              "runnerPlay": {
                "outBases": [0, 0, 4, 0],
                "outKinds": ["none", "none", "tag", "none"],
                "runsBeforeOuts": false
              },
              "weight": 3012
            },